{
  "schemaVersion": 2,
  "contentRevision": "ws-content-r2",
  "domain": "final",
  "records": [
    {
      "id": "FINAL-D50-FIRST-RECONSTRUCTION-SIGNAL",
      "sourceDocumentId": "FINAL-DATA-001",
      "enabled": true,
      "recordKind": "OBJECTIVE",
      "executionOpcode": "FINAL_STATE_MACHINE",
      "minimumDay": 50,
      "requiredBossIds": [
        "BOSS-001",
        "BOSS-002",
        "BOSS-003",
        "BOSS-004"
      ],
      "requiredPartIds": [
        "A",
        "B",
        "C",
        "D"
      ],
      "requiredDiscoveryIds": [
        "C27",
        "C28-A",
        "C28-B",
        "C28-C",
        "C28-D",
        "C29"
      ],
      "facilityRequirements": {
        "FAC-R01": "READY",
        "FAC-R02": "READY",
        "FAC-R03": "READY",
        "FAC-R04": "READY",
        "FAC-R05": "CALIBRATED:3",
        "FAC-R06": "READY"
      },
      "uniqueInputId": "WSR-FINAL_SIGNAL_KEY",
      "forbiddenActive": [
        "BOSS",
        "SIEGE",
        "BLOCKING_TRANSACTION"
      ],
      "stateMachine": [
        "LOCKED",
        "AVAILABLE",
        "ACTIVATING",
        "ACTIVE_STAGE_1",
        "ACTIVE_STAGE_2",
        "ACTIVE_STAGE_3",
        "RESOLVING",
        "COMPLETED"
      ],
      "stage1BudgetByParty": [
        {
          "partySize": 1,
          "total": 60,
          "waveBudgets": [
            20,
            20,
            20
          ],
          "activeCap": 8
        },
        {
          "partySize": 2,
          "total": 90,
          "waveBudgets": [
            30,
            30,
            30
          ],
          "activeCap": 10
        },
        {
          "partySize": 3,
          "total": 117,
          "waveBudgets": [
            29,
            29,
            29,
            30
          ],
          "activeCap": 12
        },
        {
          "partySize": 4,
          "total": 144,
          "waveBudgets": [
            36,
            36,
            36,
            36
          ],
          "activeCap": 12
        }
      ],
      "arena": {
        "facilityDistanceMin": 18,
        "facilityDistanceMax": 36,
        "bodySpawnClearance": 12,
        "combatRadius": 50,
        "recoveryRadius": 70,
        "stakeCount": 3,
        "stakeDistanceMin": 14,
        "stakeDistanceMax": 24,
        "stakeSeparationMin": 18,
        "candidateCount": 24,
        "candidatesPerTick": 2
      },
      "raw": [
        "FINAL-D50-FIRST-RECONSTRUCTION-SIGNAL",
        "Day 50+",
        "first reconstruction signal"
      ]
    },
    {
      "id": "FINAL-BOSS-WORLD-COLLAPSE-CORE",
      "sourceDocumentId": "FINAL-DATA-001",
      "enabled": true,
      "recordKind": "FINAL_BOSS",
      "executionOpcode": "FINAL_BOSS_PATTERN_CONTROLLER",
      "representation": "Ravager 이동 코어 + 다중 Display 외피",
      "defence": 240,
      "penetration": 50,
      "resistance": 135,
      "tenacity": 70,
      "staggerResistance": 75,
      "moveSpeedSprintRatio": 0.86,
      "partyProfiles": [
        {
          "partySize": 1,
          "hp": 900000,
          "breakMax": 33750,
          "summonCap": 2,
          "simultaneousTargets": 1
        },
        {
          "partySize": 2,
          "hp": 1250000,
          "breakMax": 45000,
          "summonCap": 3,
          "simultaneousTargets": 1
        },
        {
          "partySize": 3,
          "hp": 1650000,
          "breakMax": 56250,
          "summonCap": 4,
          "simultaneousTargets": 2
        },
        {
          "partySize": 4,
          "hp": 2000000,
          "breakMax": 67500,
          "summonCap": 4,
          "simultaneousTargets": 2
        }
      ],
      "breakResult": {
        "groggyTicks": 100,
        "damageTakenMultiplier": 1.15,
        "maxApRestoreRatio": 0.2,
        "facilityOutputGain": 10,
        "nextGaugeIncreaseRatio": 0.2,
        "gaugeIncreaseCapRatio": 1.0
      },
      "dotHpPerSecondCapRatio": 0.005,
      "slowCapRatio": 0.15,
      "immuneStatuses": [
        "SILENCE",
        "DISARM"
      ],
      "zeroHpState": "CORE_SUBDUED",
      "raw": [
        "FINAL-BOSS-WORLD-COLLAPSE-CORE",
        "Stage 2"
      ]
    },
    {
      "id": "F50-STAKE",
      "sourceDocumentId": "FINAL-DATA-001",
      "enabled": true,
      "recordKind": "OBJECTIVE_COMPONENT",
      "executionOpcode": "FINAL_STAKE_CHANNEL",
      "count": 3,
      "maxProgress": 100,
      "interactionTicks": 60,
      "interactionGain": 25,
      "enemyClearGain": 15,
      "breakGain": 10,
      "minimumPreservedProgress": 10,
      "raw": [
        "F50-STAKE",
        "3",
        "100/개",
        "3초 상호작용 +25, 주변 주요 적 제거 +15, 브레이크 성공 +10",
        "피격 시 채널 취소, 진행 최소10 보존"
      ]
    },
    {
      "id": "FAC-R06-OUTPUT",
      "sourceDocumentId": "FINAL-DATA-001",
      "enabled": true,
      "recordKind": "OBJECTIVE_COMPONENT",
      "executionOpcode": "FINAL_OUTPUT_CHANNEL",
      "count": 1,
      "maxProgress": 100,
      "validChannelGainPerSecond": 2,
      "invaderChannelLoss": 20,
      "raw": [
        "FAC-R06-OUTPUT",
        "1",
        "100",
        "유효 채널 +2/초",
        "침입체 채널 -20"
      ]
    },
    {
      "id": "FINAL-ST1-PURSUIT",
      "sourceDocumentId": "FINAL-DATA-001",
      "enabled": true,
      "recordKind": "WAVE_PROFILE",
      "executionOpcode": "EXECUTE_LOCKED_WAVE_PROFILE",
      "stage": 1,
      "waveIndex": 1,
      "roles": [
        "PARTY_TRACKER",
        "CHASER"
      ],
      "allowedPartySizes": [
        1,
        2,
        3,
        4
      ],
      "noRewards": true,
      "raw": [
        "FINAL-ST1-PURSUIT",
        "PARTY_TRACKER, CHASER"
      ]
    },
    {
      "id": "FINAL-ST1-STAKES",
      "sourceDocumentId": "FINAL-DATA-001",
      "enabled": true,
      "recordKind": "WAVE_PROFILE",
      "executionOpcode": "EXECUTE_LOCKED_WAVE_PROFILE",
      "stage": 1,
      "waveIndex": 2,
      "roles": [
        "EN-F50-A01",
        "SUPPORT_MAX_1"
      ],
      "allowedPartySizes": [
        1,
        2,
        3,
        4
      ],
      "noRewards": true,
      "raw": [
        "FINAL-ST1-STAKES",
        "EN-F50-A01, SUPPORT_MAX_1"
      ]
    },
    {
      "id": "FINAL-ST1-OUTPUT",
      "sourceDocumentId": "FINAL-DATA-001",
      "enabled": true,
      "recordKind": "WAVE_PROFILE",
      "executionOpcode": "EXECUTE_LOCKED_WAVE_PROFILE",
      "stage": 1,
      "waveIndex": 3,
      "roles": [
        "EN-F50-A02",
        "SIEGE_MAX_1"
      ],
      "allowedPartySizes": [
        1,
        2,
        3,
        4
      ],
      "noRewards": true,
      "raw": [
        "FINAL-ST1-OUTPUT",
        "EN-F50-A02, SIEGE_MAX_1"
      ]
    },
    {
      "id": "FINAL-ST1-MIXED",
      "sourceDocumentId": "FINAL-DATA-001",
      "enabled": true,
      "recordKind": "WAVE_PROFILE",
      "executionOpcode": "EXECUTE_LOCKED_WAVE_PROFILE",
      "stage": 1,
      "waveIndex": 4,
      "roles": [
        "PARTY_SIZE_3_OR_4",
        "ELITE_MAX_1"
      ],
      "allowedPartySizes": [
        3,
        4
      ],
      "noRewards": true,
      "raw": [
        "FINAL-ST1-MIXED",
        "PARTY_SIZE_3_OR_4, ELITE_MAX_1"
      ]
    },
    {
      "id": "FINAL-ST3-STATUS",
      "sourceDocumentId": "FINAL-DATA-001",
      "enabled": true,
      "recordKind": "WAVE_PROFILE",
      "executionOpcode": "EXECUTE_LOCKED_WAVE_PROFILE",
      "stage": 3,
      "fromSecond": 0,
      "toSecond": 60,
      "budgetByPartySize": [
        {
          "partySize": 2,
          "threat": 30
        },
        {
          "partySize": 3,
          "threat": 39
        },
        {
          "partySize": 4,
          "threat": 48
        }
      ],
      "rolesText": "상태·이동, 방해자0~1",
      "noRewards": true,
      "raw": [
        "FINAL-ST3-STATUS",
        "0~60초",
        "30/39/48",
        "상태·이동, 방해자0~1"
      ]
    },
    {
      "id": "FINAL-ST3-CORRUPTION",
      "sourceDocumentId": "FINAL-DATA-001",
      "enabled": true,
      "recordKind": "WAVE_PROFILE",
      "executionOpcode": "EXECUTE_LOCKED_WAVE_PROFILE",
      "stage": 3,
      "fromSecond": 60,
      "toSecond": 120,
      "budgetByPartySize": [
        {
          "partySize": 2,
          "threat": 36
        },
        {
          "partySize": 3,
          "threat": 47
        },
        {
          "partySize": 4,
          "threat": 58
        }
      ],
      "rolesText": "출력 방해자1, 지원1",
      "noRewards": true,
      "raw": [
        "FINAL-ST3-CORRUPTION",
        "60~120초",
        "36/47/58",
        "출력 방해자1, 지원1"
      ]
    },
    {
      "id": "FINAL-ST3-SIEGE",
      "sourceDocumentId": "FINAL-DATA-001",
      "enabled": true,
      "recordKind": "WAVE_PROFILE",
      "executionOpcode": "EXECUTE_LOCKED_WAVE_PROFILE",
      "stage": 3,
      "fromSecond": 120,
      "toSecond": 180,
      "budgetByPartySize": [
        {
          "partySize": 2,
          "threat": 42
        },
        {
          "partySize": 3,
          "threat": 55
        },
        {
          "partySize": 4,
          "threat": 67
        }
      ],
      "rolesText": "공성1, 정예1",
      "noRewards": true,
      "raw": [
        "FINAL-ST3-SIEGE",
        "120~180초",
        "42/55/67",
        "공성1, 정예1"
      ]
    },
    {
      "id": "F50-P1-COLLAPSE-PURSUIT",
      "sourceDocumentId": "FINAL-DATA-001",
      "enabled": true,
      "recordKind": "BOSS_PHASE",
      "executionOpcode": "ENTER_FINAL_BOSS_PHASE",
      "hpRangeText": "100~72%",
      "patternPoolText": "CUT, STATUS_QUADRANT, TRACK_LINE, ECHO_SUMMON",
      "repeatRuleText": "같은 ID 2회 연속 금지",
      "transitionSafeTicks": 80,
      "resetBreakOnEntry": true,
      "retainAccumulatedResistance": true,
      "raw": [
        "F50-P1-COLLAPSE-PURSUIT",
        "100~72%",
        "CUT, STATUS_QUADRANT, TRACK_LINE, ECHO_SUMMON",
        "같은 ID 2회 연속 금지"
      ]
    },
    {
      "id": "F50-P2-CORRUPTION-GRAFT",
      "sourceDocumentId": "FINAL-DATA-001",
      "enabled": true,
      "recordKind": "BOSS_PHASE",